sudo tcpdump -i ens33 -nt '(src 192.168.116.136 and dst 192.168.116.135) or (src 192.168.116.136 and dst 192.168.116.135)'

IP 192.168.116.136.23 > 192.168.116.135.42230: Flags [S.], seq 1957185567, ack 925685765, win 65160, options 

IP 192.168.116.136.23 > 192.168.116.135.42230: Flags [.], ack 28, win 509

IP 192.168.116.136.23 > 192.168.116.135.42230: Flags [P.], seq 1:13, ack 28, win 509

IP 192.168.116.136.23 > 192.168.116.135.42230: Flags [P.], seq 13:52, ack 28, win 509

IP 192.168.116.136.23 > 192.168.116.135.42230: Flags [.], ack 114, win 509

IP 192.168.116.136.23 > 192.168.116.135.42230: Flags [P.], seq 52:55, ack 114, win 509

IP 192.168.116.136.23 > 192.168.116.135.42230: Flags [.], ack 117, win 509

IP 192.168.116.136.23 > 192.168.116.135.42230: Flags [P.], seq 55:58, ack 117, win 509

IP 192.168.116.136.23 > 192.168.116.135.42230: Flags [P.], seq 58:72, ack 120, win 509

IP 192.168.116.136.23 > 192.168.116.135.42230: Flags [F.], seq 93, ack 121, win 50999






